{
  "version" : "1.0",
  "modelType" : "structural",
  "nodes" : [ {
    "id" : "node-1",
    "label" : "",
    "coordinates" : {
      "x" : -6.0,
      "z" : 4.0
    },
    "constraints" : {
      "x" : false,
      "z" : true,
      "r" : false
    },
    "loads" : {
      "fx" : 0.0,
      "fz" : 0.0,
      "m" : 0.0
    }
  }, {
    "id" : "node-2",
    "label" : "",
    "coordinates" : {
      "x" : -6.0,
      "z" : -2.0
    },
    "constraints" : {
      "x" : false,
      "z" : false,
      "r" : false
    },
    "loads" : {
      "fx" : 0.0,
      "fz" : 0.0,
      "m" : 0.0
    }
  }, {
    "id" : "node-3",
    "label" : "",
    "coordinates" : {
      "x" : 6.0,
      "z" : -2.0
    },
    "constraints" : {
      "x" : false,
      "z" : false,
      "r" : false
    },
    "loads" : {
      "fx" : 0.0,
      "fz" : 0.0,
      "m" : 0.0
    }
  }, {
    "id" : "node-4",
    "label" : "",
    "coordinates" : {
      "x" : 10.0,
      "z" : -2.0
    },
    "constraints" : {
      "x" : false,
      "z" : false,
      "r" : false
    },
    "loads" : {
      "fx" : 0.0,
      "fz" : 5.0,
      "m" : 0.0
    }
  }, {
    "id" : "node-5",
    "label" : "",
    "coordinates" : {
      "x" : 6.0,
      "z" : 4.0
    },
    "constraints" : {
      "x" : true,
      "z" : true,
      "r" : false
    },
    "loads" : {
      "fx" : 0.0,
      "fz" : 0.0,
      "m" : 0.0
    }
  } ],
  "beams" : [ {
    "type" : "ebbeam",
    "id" : "beam-1",
    "label" : "",
    "nodeIds" : [ "node-1", "node-2" ],
    "mass" : 1.0,
    "material" : {
      "EA" : 100000.0,
      "EI" : 10000.0
    },
    "distributedLoads" : {
      "vi" : 0.0,
      "vk" : 0.0,
      "ni" : 0.0,
      "nk" : 0.0
    },
    "internalHinges" : {
      "ni" : false,
      "vi" : false,
      "mi" : false,
      "nk" : false,
      "vk" : false,
      "mk" : false
    }
  }, {
    "type" : "ebbeam",
    "id" : "beam-2",
    "label" : "",
    "nodeIds" : [ "node-5", "node-3" ],
    "mass" : 1.0,
    "material" : {
      "EA" : 100000.0,
      "EI" : 10000.0
    },
    "distributedLoads" : {
      "vi" : 0.0,
      "vk" : 0.0,
      "ni" : 0.0,
      "nk" : 0.0
    },
    "internalHinges" : {
      "ni" : false,
      "vi" : false,
      "mi" : false,
      "nk" : false,
      "vk" : false,
      "mk" : false
    }
  }, {
    "type" : "ebbeam",
    "id" : "beam-3",
    "label" : "",
    "nodeIds" : [ "node-2", "node-3" ],
    "mass" : 1.0,
    "material" : {
      "EA" : 100000.0,
      "EI" : 10000.0
    },
    "distributedLoads" : {
      "vi" : 0.0,
      "vk" : 0.0,
      "ni" : 0.0,
      "nk" : 0.0
    },
    "internalHinges" : {
      "ni" : false,
      "vi" : false,
      "mi" : false,
      "nk" : false,
      "vk" : false,
      "mk" : false
    }
  }, {
    "type" : "ebbeam",
    "id" : "beam-4",
    "label" : "",
    "nodeIds" : [ "node-3", "node-4" ],
    "mass" : 1.0,
    "material" : {
      "EA" : 100000.0,
      "EI" : 10000.0
    },
    "distributedLoads" : {
      "vi" : 0.0,
      "vk" : 0.0,
      "ni" : 0.0,
      "nk" : 0.0
    },
    "internalHinges" : {
      "ni" : false,
      "vi" : false,
      "mi" : false,
      "nk" : false,
      "vk" : false,
      "mk" : false
    }
  } ]
}